{"boundary":{"containsMarketObservations":false,"containsProviderCredentials":false,"containsProviderSelection":false,"methodRankingProduced":false,"methodScoreProduced":false,"performanceClaimAllowed":false,"realDataRequestCreated":false,"thresholdSelectionAllowed":false},"executionAllowed":false,"financialUseAllowed":false,"gateReadiness":[{"gateId":"G01_SYNTHETIC_REAL_ISOLATION","ownerExplanationFa":"باید ثابت شود هیچ ردیف ساختگی وارد مجموعهٔ واقعی نشده است.","ownerStateFa":"تمرین نرم‌افزاری عبور کرد؛ بررسی واقعی انجام نشده است","ownerTitleFa":"جداسازی دادهٔ ساختگی و واقعی","realWorldState":"not_evaluated","remainingEvidence":[{"evidenceId":"REAL_DATASET_BOUNDARY_DECLARATION","ownerLabelFa":"تعریف رسمی مرز مجموعه‌دادهٔ واقعی","state":"required_not_supplied"},{"evidenceId":"SYNTHETIC_ROW_EXCLUSION_AUDIT","ownerLabelFa":"گزارش اثبات نبود ردیف ساختگی در دادهٔ واقعی","state":"required_not_supplied"}],"remainingEvidenceCount":2,"stage":"data","syntheticMechanicalState":"passed"},{"gateId":"G02_LICENSE_AND_PROVENANCE","ownerExplanationFa":"مجوز استفاده و مسیر تولید هر ردیف واقعی باید قابل پیگیری باشد.","ownerStateFa":"تمرین نرم‌افزاری عبور کرد؛ بررسی واقعی انجام نشده است","ownerTitleFa":"مجوز و شناسنامهٔ داده","realWorldState":"not_evaluated","remainingEvidence":[{"evidenceId":"OWNER_APPROVED_LICENSE_REFERENCES","ownerLabelFa":"مجوزهای کتبی و تأییدشدهٔ منابع","state":"required_not_supplied"},{"evidenceId":"IMMUTABLE_SOURCE_CONTRACT_LINEAGE","ownerLabelFa":"شناسنامهٔ تغییرناپذیر قرارداد منبع برای هر ردیف","state":"required_not_supplied"},{"evidenceId":"INDEPENDENT_IRAN_SOURCE_CROSS_CHECK","ownerLabelFa":"تطبیق با یک منبع مستقل ایرانی","state":"required_not_supplied"}],"remainingEvidenceCount":3,"stage":"data","syntheticMechanicalState":"passed"},{"gateId":"G03_POINT_IN_TIME_INTEGRITY","ownerExplanationFa":"هر محاسبه باید فقط اطلاعات موجود در همان زمان تاریخی را ببیند.","ownerStateFa":"تمرین نرم‌افزاری عبور کرد؛ بررسی واقعی انجام نشده است","ownerTitleFa":"جلوگیری از دیدن آینده","realWorldState":"not_evaluated","remainingEvidence":[{"evidenceId":"OBSERVED_AT_UTC_LINEAGE","ownerLabelFa":"زمان واقعی مشاهده برای هر ردیف","state":"required_not_supplied"},{"evidenceId":"AVAILABLE_AT_UTC_LINEAGE","ownerLabelFa":"زمان واقعی قابل‌دسترسی‌شدن هر ردیف","state":"required_not_supplied"},{"evidenceId":"SOURCE_CONTRACT_VERSION_LINEAGE","ownerLabelFa":"نسخهٔ قرارداد منبع در همان زمان","state":"required_not_supplied"},{"evidenceId":"FUTURE_INFORMATION_EXCLUSION_AUDIT","ownerLabelFa":"آزمون مستقل جلوگیری از ورود اطلاعات آینده","state":"required_not_supplied"}],"remainingEvidenceCount":4,"stage":"data","syntheticMechanicalState":"passed"},{"gateId":"G04_HISTORY_AND_COVERAGE","ownerExplanationFa":"هر عامل باید حداقل تاریخچه و پوشش ازپیش‌تعیین‌شده را داشته باشد.","ownerStateFa":"تمرین نرم‌افزاری عبور کرد؛ بررسی واقعی انجام نشده است","ownerTitleFa":"طول و پوشش تاریخچه","realWorldState":"not_evaluated","remainingEvidence":[{"evidenceId":"CONCENTRATION_HISTORY_COVERAGE","ownerLabelFa":"تمرکز سبد: حداقل 252 مشاهدهٔ معتبر، پوشش 100.000000٪، 1 منبع و 3 دورهٔ متفاوت","state":"required_not_supplied"},{"evidenceId":"CONVERSION_COST_HISTORY_COVERAGE","ownerLabelFa":"هزینهٔ تبدیل: حداقل 504 مشاهدهٔ معتبر، پوشش 95.000000٪، 2 منبع و 3 دورهٔ متفاوت","state":"required_not_supplied"},{"evidenceId":"CRISIS_RESILIENCE_HISTORY_COVERAGE","ownerLabelFa":"تاب‌آوری بحران: حداقل 1260 مشاهدهٔ معتبر، پوشش 95.000000٪، 2 منبع و 3 دورهٔ متفاوت","state":"required_not_supplied"},{"evidenceId":"DRAWDOWN_HISTORY_COVERAGE","ownerLabelFa":"افت سرمایه: حداقل 1260 مشاهدهٔ معتبر، پوشش 98.000000٪، 2 منبع و 3 دورهٔ متفاوت","state":"required_not_supplied"},{"evidenceId":"LIQUIDITY_HISTORY_COVERAGE","ownerLabelFa":"نقدشوندگی: حداقل 756 مشاهدهٔ معتبر، پوشش 95.000000٪، 2 منبع و 3 دورهٔ متفاوت","state":"required_not_supplied"},{"evidenceId":"TREND_HISTORY_COVERAGE","ownerLabelFa":"روند: حداقل 1260 مشاهدهٔ معتبر، پوشش 98.000000٪، 2 منبع و 3 دورهٔ متفاوت","state":"required_not_supplied"},{"evidenceId":"VALUATION_HISTORY_COVERAGE","ownerLabelFa":"ارزش‌گذاری: حداقل 756 مشاهدهٔ معتبر، پوشش 95.000000٪، 2 منبع و 3 دورهٔ متفاوت","state":"required_not_supplied"},{"evidenceId":"VOLATILITY_HISTORY_COVERAGE","ownerLabelFa":"نوسان: حداقل 1260 مشاهدهٔ معتبر، پوشش 98.000000٪، 2 منبع و 3 دورهٔ متفاوت","state":"required_not_supplied"}],"remainingEvidenceCount":8,"stage":"data","syntheticMechanicalState":"passed"},{"gateId":"G05_IRAN_MARKET_EVIDENCE","ownerExplanationFa":"فرض‌های مربوط به ایران باید جداگانه و با مدرک واقعی بررسی شوند.","ownerStateFa":"تمرین نرم‌افزاری عبور کرد؛ بررسی واقعی انجام نشده است","ownerTitleFa":"شواهد ویژهٔ بازار ایران","realWorldState":"not_evaluated","remainingEvidence":[{"evidenceId":"CONCENTRATION_OWNER_LEDGER_AND_MARKET_CUTOFF_ALIGNED","ownerLabelFa":"تمرکز سبد: اثبات هم‌زمانی دفتر دارایی مالک و برش بازار","state":"required_not_supplied"},{"evidenceId":"CONCENTRATION_STALE_DOMESTIC_VALUATIONS_EXCLUDED","ownerLabelFa":"تمرکز سبد: اثبات حذف ارزش‌گذاری‌های داخلی کهنه","state":"required_not_supplied"},{"evidenceId":"CONVERSION_COST_PHYSICAL_AND_DIGITAL_ROUTES_SEPARATED","ownerLabelFa":"هزینهٔ تبدیل: تفکیک مسیرهای فیزیکی و دیجیتال تبدیل","state":"required_not_supplied"},{"evidenceId":"CONVERSION_COST_TAX_FEE_AND_SPREAD_COMPONENTS_NOT_NETTED_AWAY","ownerLabelFa":"هزینهٔ تبدیل: تفکیک مالیات، کارمزد و فاصلهٔ خریدوفروش","state":"required_not_supplied"},{"evidenceId":"CRISIS_RESILIENCE_NON_TRADABLE_DAYS_NOT_TREATED_AS_ZERO_RISK","ownerLabelFa":"تاب‌آوری بحران: اثبات اینکه روز غیرقابل‌معامله بدون ریسک فرض نشده است","state":"required_not_supplied"},{"evidenceId":"CRISIS_RESILIENCE_POLITICAL_FX_AND_MARKET_CLOSURE_WINDOWS_LABELLED","ownerLabelFa":"تاب‌آوری بحران: برچسب‌گذاری بحران سیاسی، ارزی و تعطیلی بازار","state":"required_not_supplied"},{"evidenceId":"DRAWDOWN_CLOSURES_AND_PRICE_LIMITS_RETAINED","ownerLabelFa":"افت سرمایه: حفظ تعطیلی‌ها و محدودیت‌های قیمت در داده","state":"required_not_supplied"},{"evidenceId":"DRAWDOWN_CORPORATE_AND_INSTRUMENT_SPEC_CHANGES_ADJUSTED_POINT_IN_TIME","ownerLabelFa":"افت سرمایه: اصلاح زمانی تغییر مشخصات ابزار","state":"required_not_supplied"},{"evidenceId":"LIQUIDITY_DISPLAYED_QUOTE_NOT_ASSUMED_EXECUTABLE","ownerLabelFa":"نقدشوندگی: اثبات اینکه قیمت نمایشی قابل‌اجرا فرض نشده است","state":"required_not_supplied"},{"evidenceId":"LIQUIDITY_THIN_MARKET_AND_PRICE_LIMIT_SESSIONS_SEPARATED","ownerLabelFa":"نقدشوندگی: تفکیک بازار کم‌عمق و جلسات محدودیت قیمت","state":"required_not_supplied"},{"evidenceId":"TREND_INFLATION_AND_FX_REGIMES_SEPARATED","ownerLabelFa":"روند: تفکیک دوره‌های تورمی و ارزی ایران","state":"required_not_supplied"},{"evidenceId":"TREND_NON_SYNCHRONOUS_MARKET_CLOSES_ALIGNED_WITH_AVAILABILITY","ownerLabelFa":"روند: هم‌ترازی تعطیلی‌های ناهم‌زمان با زمان دسترسی","state":"required_not_supplied"},{"evidenceId":"VALUATION_COIN_AND_BULLION_SPECIFICATIONS_VERSIONED_SEPARATELY","ownerLabelFa":"ارزش‌گذاری: نسخه‌بندی جداگانهٔ مشخصات سکه و شمش","state":"required_not_supplied"},{"evidenceId":"VALUATION_GLOBAL_SPOT_AND_FX_TIMESTAMPS_SYNCHRONIZED","ownerLabelFa":"ارزش‌گذاری: هم‌زمان‌سازی قیمت جهانی و نرخ ارز","state":"required_not_supplied"},{"evidenceId":"VOLATILITY_STALE_AND_NON_TRADABLE_PERIODS_NOT_RECORDED_AS_ZERO_RETURN","ownerLabelFa":"نوسان: ثبت‌نشدن دورهٔ کهنه یا غیرقابل‌معامله به‌عنوان بازده صفر","state":"required_not_supplied"},{"evidenceId":"VOLATILITY_VOLATILITY_WINDOWS_FROZEN_BEFORE_TEST_ACCESS","ownerLabelFa":"نوسان: قفل پنجره‌های نوسان پیش از آزمون","state":"required_not_supplied"},{"evidenceId":"MINIMUM_DISTINCT_IRAN_REGIMES","ownerLabelFa":"حداقل 3 دورهٔ متفاوت بازار ایران","state":"required_not_supplied"},{"evidenceId":"MINIMUM_IRAN_CRISIS_WINDOWS","ownerLabelFa":"حداقل 3 پنجرهٔ بحران ایران","state":"required_not_supplied"}],"remainingEvidenceCount":18,"stage":"data","syntheticMechanicalState":"passed"},{"gateId":"G06_TRAIN_VALIDATION_TEST_ISOLATION","ownerExplanationFa":"سه بازه باید زمانی، بدون هم‌پوشانی و بدون نشت اطلاعات باشند.","ownerStateFa":"تمرین نرم‌افزاری عبور کرد؛ بررسی واقعی انجام نشده است","ownerTitleFa":"جداسازی آموزش، تنظیم و آزمون","realWorldState":"not_evaluated","remainingEvidence":[{"evidenceId":"CHRONOLOGICAL_TRAIN_SPLIT","ownerLabelFa":"بازهٔ آموزش با 756 مشاهده","state":"required_not_supplied"},{"evidenceId":"CHRONOLOGICAL_VALIDATION_SPLIT","ownerLabelFa":"بازهٔ تنظیم با 252 مشاهده","state":"required_not_supplied"},{"evidenceId":"UNTOUCHED_TEST_SPLIT","ownerLabelFa":"بازهٔ آزمون دست‌نخورده با 252 مشاهده","state":"required_not_supplied"},{"evidenceId":"PURGE_GAP","ownerLabelFa":"فاصلهٔ حذف 20 مشاهده‌ای","state":"required_not_supplied"},{"evidenceId":"EMBARGO_GAP","ownerLabelFa":"فاصلهٔ محافظ 5 مشاهده‌ای","state":"required_not_supplied"},{"evidenceId":"SPLIT_LEAKAGE_AUDIT","ownerLabelFa":"گزارش نبود هم‌پوشانی یا نشت میان سه بازه","state":"required_not_supplied"}],"remainingEvidenceCount":6,"stage":"fit","syntheticMechanicalState":"passed"},{"gateId":"G07_PARAMETER_FREEZE","ownerExplanationFa":"پارامترهای واقعی باید پیش از دیدن آزمون نهایی ثبت و قفل شوند.","ownerStateFa":"تمرین نرم‌افزاری عبور کرد؛ بررسی واقعی انجام نشده است","ownerTitleFa":"قفل پارامترها پیش از آزمون","realWorldState":"not_evaluated","remainingEvidence":[{"evidenceId":"REAL_DATASET_FINGERPRINT","ownerLabelFa":"اثر انگشت مجموعه‌دادهٔ مجاز ایران","state":"required_not_supplied"},{"evidenceId":"REAL_PARAMETER_BUNDLE_FROZEN_BEFORE_TEST","ownerLabelFa":"بستهٔ واقعی پارامترها پیش از بازشدن آزمون","state":"required_not_supplied"},{"evidenceId":"ALL_IN_CONVERSION_COST","ownerLabelFa":"هزینهٔ کامل و قابل‌اجرای تبدیل","state":"required_not_supplied"},{"evidenceId":"CONCENTRATION_DISTRIBUTION","ownerLabelFa":"توزیع واقعی تمرکز سبد","state":"required_not_supplied"},{"evidenceId":"ESTIMATED_SLIPPAGE","ownerLabelFa":"لغزش قیمت برآوردشده از معاملهٔ قابل‌اجرا","state":"required_not_supplied"},{"evidenceId":"EXECUTABLE_LIQUIDITY_CAPACITY","ownerLabelFa":"ظرفیت واقعی نقدشوندگی","state":"required_not_supplied"},{"evidenceId":"EXECUTABLE_MARKET_DEPTH","ownerLabelFa":